{"$schema":"https://json-schema.org/draft/2020-12/schema","$id":"https://agensfield.dev/scriba/schemas/codex-reset.schema.json","title":"Scriba Codex reset output","type":"object","additionalProperties":false,"required":["schemaVersion","providerId","source","dryRun","outcome","windowsReset","availableBefore","credit","authState","accountId","credentialsAvailable"],"properties":{"schemaVersion":{"const":"scriba.v1"},"providerId":{"const":"codex"},"source":{"const":"chatgpt-codex-backend"},"dryRun":{"type":"boolean"},"outcome":{"enum":["planned","reset","nothing_to_reset","no_credit","already_redeemed"]},"windowsReset":{"type":"integer","minimum":0},"availableBefore":{"type":"integer","minimum":0},"weeklyUsedPercentBefore":{"type":"number","minimum":0,"maximum":100},"weeklyResetsAt":{"type":"string","format":"date-time"},"credit":{"$ref":"codex-limits.schema.json#/$defs/resetCredit"},"authState":{"$ref":"codex-limits.schema.json#/$defs/authState"},"accountId":{"type":"string","pattern":"^acct-[0-9a-f]{20}$"},"accountAlias":{"type":"string","minLength":1,"maxLength":32},"credentialsAvailable":{"type":"boolean"}}}
