{"accountId":"acct-0123456789abcdef0123","authState":{"ok":true,"source":"codex-auth"},"availableBefore":2,"credentialsAvailable":true,"credit":{"expiresAt":"2026-07-18T00:29:25Z","id":"credit-oldest","resetType":"codex_rate_limits","status":"available","title":"Full reset"},"dryRun":true,"outcome":"planned","providerId":"codex","schemaVersion":"scriba.v1","source":"chatgpt-codex-backend","weeklyResetsAt":"2026-07-23T04:15:55Z","weeklyUsedPercentBefore":86,"windowsReset":0}
